date,time,username,tweet,likes_count
2021-02-12,17:40:06,nytimes,Three men in Baltimore have been accused by federal prosecutors of putting up a fake duplicate of the Moderna website to sell Covid-19 vaccines for $30 a dose.  https://t.co/KTzuUgdSIl,165
2021-02-12,17:27:52,rogerclark41,"My barber just made a good point. Shouldn’t they be eligible for vaccine sooner than later? Hairstylists etc. As he said, I can’t cut your hair from across the room #HeHasAPoint #NYC",144
2021-02-12,17:16:34,nycmayor,"Today, Eva was able to get the COVID-19 vaccine at our Nostrand Houses vaccination site. She was nervous at first, but her 95-year-old sister got the vaccine, so she knew she could too.  This is about making sure everyone, especially our seniors, has a chance to get vaccinated.  https://t.co/TI0WRE1a4O",91
2021-02-12,17:00:03,cbssunday,A bakery in Germany is selling COVID-19 vaccine-themed doughnuts. The syringe is filled with a lemon-ginger shot and the doughnut has a passion fruit-coconut-chia filling. Check out how they are made.  https://t.co/2OzygT0RaF,75
2021-02-12,16:44:18,sruhle,"As more people get the vaccine, going back to the office is becoming more likely.   Where do you stand on returning to work vs. working from home? Do you fear exposure to the virus?",853
2021-02-12,16:21:35,repmaloney,"Today, I'm chairing an @OversightDems meeting on the #AmericanRescuePlan – incl. $350B in relief to states, local gov'ts, Tribes, &amp; territories.  This $ will allow them to deliver vaccines faster, expand testing, &amp; help save jobs of teachers, first responders, &amp; essential workers  https://t.co/n8s7QsNpf0",70
2021-02-12,16:02:02,paulrieckhoff,These are the reinforcements America needs now. And that we needed a year ago. Our troops should be utilized to help distribute the vaccine. Not to crush peaceful protestors. Yet another example of why elections matter. #LookForTheHelpers,76
2021-02-12,15:50:40,nygovcuomo,"10,000! Lissette Gonzalez, a guidance counselor at South Bronx Prep, received the 10,000th vaccine dose administered at Yankee Stadium today.  Lissette said she’s a lifelong @Yankees fan and is looking forward to coming back for her 2nd shot in 3 weeks. #VaccinateNY  https://t.co/d3kn9iNbsg",1498
2021-02-12,15:26:09,maxboot,"Tucker left his audience with the impression that covid vaccines are part of a plot against them by powerful, shadowy forces.   One fact Carlson did not mention: His boss, Rupert Murdoch, has already been vaccinated.  https://t.co/8HcgConVSD",586
2021-02-12,15:23:49,kathbarbadoro,it's cool how i am probably going to get the vaccine before my 62 year old mother who survived breast cancer and is teaching this semester because the new hampshire governor hates the teacher's union,85
2021-02-12,14:56:20,yankees,"Today, guidance counselor and lifelong Yankees fan Lissette Gonzalez of South Bronx Prep received the 10,000th dose of the Pfizer Covid-19 vaccine at Yankee Stadium, administered by Dr. Juan Tapia! #VaccinateNY  📸: Kevin P. Coughlin / Office of Governor Andrew M. Cuomo  https://t.co/FRj5var7bI",1281
2021-02-12,14:50:46,gerardaraud,"Vacciné! Une petite déception: apparemment, on n’a pas la 5G après la première piqure.",1021
2021-02-12,14:22:59,nypmetro,More than 300 Holocaust survivors get COVID-19 vaccine in Brooklyn  https://t.co/EJT316DQ54  https://t.co/vUwR1wHe9f,61
2021-02-12,14:22:59,nypost,More than 300 Holocaust survivors get COVID-19 vaccine in Brooklyn  https://t.co/Ijey3OjM6m  https://t.co/vz8izwmdGS,296
2021-02-12,14:10:33,maxboot,Tucker’s conspiracy mongering is likely to discourage Fox’s elderly viewers—at the highest risk of dying from covid-19—from getting vaccines that could save their lives.  One fact he did not mention: His boss Rupert Murdoch has already been vaccinated.  https://t.co/8HcgCoFwKb,185
2021-02-12,13:28:45,theintercept,"South African Archbishop Denounces Coronavirus Vaccine Apartheid  “I would say to President Biden: You have an amazing opportunity to be a force for good in the world,” Archbishop Thabo Cecil Makgoba told The Intercept.  Full story:  https://t.co/04LudebfoZ  https://t.co/M3AWQ9OEs7",236
2021-02-12,13:28:05,nycmayor,A recovery for all of us begins with #COVID19 vaccines for ALL. Join us at @NYCHA Nostrand Houses in Brooklyn.  https://t.co/4ONADjDRDe,75
2021-02-12,13:15:54,nyulangone,Spike Lee celebrates #BlackHistoryMonth by getting his first dose of the #COVID19 vaccine at @nyulangone. We're honored to be a part of his public message to encourage vaccination among communities hit hardest by COVID.  https://t.co/1jhaxQTvJr,59
2021-02-12,13:12:14,albertbourla,"We're committed to helping ensure the most vulnerable in society, wherever they are in the world, receive protection from the threat of #COVID19. We will proudly work with @UNICEF to supply the Pfizer-BioNTech vaccine through 2021.  https://t.co/e3Pkzphi8V",89
2021-02-12,12:58:40,nytimes,"Breaking News: The FDA is said to have told Moderna it can put up to 40% more coronavirus vaccine into each vial, a simple way to potentially boost strained supplies.  https://t.co/G1hIgWe8jx",455
2021-02-12,12:30:16,nytimes,"After a slow start, the vaccine rollout in the U.S. has become more efficient, health officials say.  https://t.co/LrYK9T4Yac",563
2021-02-12,12:06:18,unicefchief,"As we respond to the COVID-19 pandemic, we must set the stage for an equal recovery.  This week, I joined @DrTedros to call on leaders to look beyond their borders and ensure fair distribution of vaccines.  https://t.co/648n2De7nx",307
2021-02-12,11:44:48,pfizer,We are proud to have this supply agreement with @UNICEF in place for our #COVID19 vaccine as a key step towards reaching at-risk healthcare workers in low income and lower-middle-income countries.,225
2021-02-12,11:36:40,charlesornstein,"Prioritizing COVID-19 vaccinations for people 75 and up can leave out Black Americans, who tend to die younger than their white counterparts. In one majority-Black county, this age gap raises questions about how to make the vaccine rollout equitable.  https://t.co/3L9JkRXH0t",59
2021-02-12,11:34:51,propublica,"New: Prioritizing COVID-19 vaccinations for people 75 and up can leave out Black Americans, who tend to die younger than their white counterparts. In one majority-Black county, this age gap raises questions about how to make the vaccine rollout equitable.  https://t.co/5DYgRoNfAm",124
2021-02-12,11:34:08,alexberenson,"1/ Okay, some real vaccine side effect data from a concerned physician with access to a big database (10000+ patients under 65). He compared ER visits of people in the 28 days BEFORE they received their first dose with the same people in the 28 days AFTER...  https://t.co/H7rQbORWpe",694
2021-02-12,11:28:33,forbes,Why doctors feel happy to get symptoms from the Covid-19 vaccine  https://t.co/EID3jpIZCA  https://t.co/56Kv5p3mG6,69
2021-02-12,11:28:28,paulkrugman,"Fun with vaccinations: I received jab 1 via the NJ system, was told to expect 2nd shot schedule within 3 days. That was more than 2 weeks ago. Don't know whether it's vaccine shortage or I fell through the cracks; every time I call the state office they say the system's down 1/",880
2021-02-12,11:27:37,oneunderscore__,Hard to find a more prescient article than this @BrandyZadrozny story from February of 2019 (!):  Vaccine Misinformation and Infowars: Researchers Wary of Facebook's Embrace of 'Groups'   https://t.co/yIjJ83Ea6y,194
2021-02-12,11:21:29,jchatterleycnn,"""Fixing your own problem can only be sustainable if you work to fix the whole problem.""  The @ICCSecGen warns #vaccine nationalism could cost the world over $9T in lost GDP - and EVERYONE will suffer.  Full interview here 👇 @iccwbo  https://t.co/hO0nC6t3wu",82
2021-02-12,11:08:00,loudwire,YES!!!: @OzzyOsbourne receives first dose of Covid-19 vaccine:  https://t.co/Wak3TQ0qza,570
2021-02-12,11:07:50,celinegounder,"Since the Pfizer and Moderna COVID were authorized by the FDA, ~20K pregnant women have been vaccinated without any red flags.  https://t.co/90asPLmNbi But formal clinical trials of the vaccines are starting in pregnant women and children now.",169
2021-02-12,11:06:26,samtayrey,Abuelo is getting his vaccine tomorrow!!!!! 🙏🙏❤️❤️❤️,86
2021-02-12,10:52:18,laurie_garrett,"“Religious fundamentalists &amp; evangelical missionaries are preaching against the vaccine,” for #COVID19 in the Amazon. Assn of Brazilian Anthropologists: religious grps are spreading false conspiracy theories, sabotaging vaccination of indigenous people.  https://t.co/KY6qWXswh6",87
2021-02-12,10:50:47,businessinsider,"Pfizer's vaccine is 93% effective, Israeli healthcare giant says. It reported 0 deaths and 4 severe cases from 520,000 vaccinated people.  https://t.co/C1DunwgjRb",281
2021-02-12,10:41:57,alexberenson,"Another endlessly repeated myth. The mRNA trials showed no statistically significant difference between vaccine and placebo in deaths or severe cases, only in mild/moderate cases. That’s because they didn’t enroll nearly enough of the old/sick people who are really at high risk.",478
2021-02-12,10:30:10,nytimes,"Hungary has become the first European Union member to begin administering Russia’s Sputnik V coronavirus vaccine, sidestepping the European Medicines Agency.  https://t.co/6LL6dCe2Wk",197
2021-02-12,10:27:46,alexberenson,It’s funny - do the folks begging @jack to deplatform me think Twitter is not watching me VERY closely? Do they think I’m unaware of that? Do they think I’ll risk my audience or my reputation by saying anything I can’t back with hard data? Especially on the vaccines.,762
2021-02-12,10:26:24,nbcnews,"US coronavirus data:  • 27,507,111 coronavirus cases (per NBC)  • 477,239 coronavirus deaths (per NBC)  • 46,390,270 vaccine doses administered (per CDC)  • 34,723,964 have gotten first shot (per CDC)  • 11,188,782 fully vaccinated (per CDC)  Data as of Feb 12, 2021",152
2021-02-12,10:19:37,alexberenson,"Nothing to see here, folks. Just school districts in multiple states being forced to close because so many teachers are having side effects following #Covid vaccinations.  And you thought the vaccine was supposed to help schools open! Silly billies  https://t.co/JAGN4ZGhMM",2202
2021-02-12,10:17:24,nbcnews,"A mostly empty queue where motorists normally line up is shown at a vaccination site at Dodger Stadium on Thursday in LA.    LA temporarily shut down 5 mass vaccination sites, including Dodger Stadium, after running out of vaccine.   📷 Marcio Jose Sanchez / AP  https://t.co/lAT7qf2w5a",61
2021-02-12,09:50:56,complex,Biden says U.S. on track to have 600 million COVID-19 vaccine doses by end of July.  https://t.co/UnUiZelHU3,249
2021-02-12,09:49:16,chelseaclinton,"Equitable access for #covid19 vaccines has to include combatting vaccine misinformation alongside equitable allocation &amp; easy to access vaccination sites (and sign-ups):  “Among Latino immigrants, false vaccine claims are spreading as fast as the virus”  https://t.co/HWABtFqu1h",349
2021-02-12,09:44:05,therecount,"Dr. Fauci: “Hopefully, by July we’ll be at that point where we have enough vaccine for virtually everyone.”  https://t.co/SkMD2Rae2T",247
2021-02-12,09:43:29,chelseaclinton,“This COVID-vaccine designer is tackling vaccine hesitancy — in churches and on Twitter.”  ⁦@KizzyPhD⁩ is a hero &amp; deserves every accolade for her tireless work:  https://t.co/VDbqn092uX,871
2021-02-12,09:40:30,chelseaclinton,Great example of the clear straightforward expert-led communication we need: “All COVID vaccines stop severe illness and death. Take what's offered.”  https://t.co/SxEpYlMMpL,1363
2021-02-12,09:38:41,drtomfrieden,"Hang in there. The pandemic won’t go on forever. By the fall, we'll be in a much better situation. Mask up and limit time indoors with people not in your household. Vaccines are coming and we're learning more every day about Covid and how to prevent and treat it.",5479
2021-02-12,09:24:04,verge,How to score a COVID-19 vaccine appointment  https://t.co/Ho3uz10Ze1  https://t.co/1lBBEUiEyB,70
2021-02-12,09:12:42,celinegounder,"Which COVID vaccine should you get? I explain, with ⁦@ZekeEmanuel⁩, @mtosterholm, @llborio, @Atul_Gawande, and @RickABright. We were all members of the Biden-Harris Transition COVID-19 Advisory Board.   https://t.co/USfq8jdN4d",207
2021-02-12,09:10:01,katearonoff,"“if the first 2b doses of Covid-19 vaccines were distributed proportionally by national population, worldwide deaths would fall by 61%. But if the doses are monopolised by  47 of the world’s richest countries, only 33% fewer people will die.”  https://t.co/v0inkVmmCJ",124
2021-02-12,08:59:15,stopantisemites,"Michigan residents, specifically teachers, are struggling to get their hands on the #COVID19 vaccine.  Meanwhile Tlaib - but those mean Jews thousands of miles away ...   The obsession is alarming.",54
2021-02-12,08:51:25,mikerugnetta,"Saw 12M US adults think QAnon is “somewhat true” and think about how I haven’t signed into Facebook in earnest in years (except to ask for help building a synth module). I often wonder who I’d log in to see sharing vaccine conspiracies, etc, if anyone.",193
2021-02-12,08:49:18,petervecsey1,"It took intervention by PBA official to get Lou Carnesecca, 96, covid vaccine several days ago in Queens where he lives. Last I heard earlier in week, Worcester, MA’s Bob Cousy, 92, had been unable to schedule appointment.",64
2021-02-12,08:37:05,amy_siskind,Yay! Dr. Fauci: It will be ‘open season’ by April for everyone to receive vaccines!  https://t.co/SW2VOHirKq,930
2021-02-12,08:30:32,katehinds,"""A 98-year-old concentration camp survivor...said she’s avoided stores and even medical visits during the pandemic and has been unable to see her grandson."" But she just got her first COVID vaccine:  https://t.co/2qJvM9l0je by @sydneyp1234 @s_nessen",67
2021-02-12,08:30:13,gothamist,"Alexander Milman is an 84-year-old Bensonhurst resident who survived a Nazi concentration camp during World War II. On Thursday, he and his wife got their first dose of a COVID-19 vaccine during a one-day pop-up site for survivors.  https://t.co/5tzUyJ6Td8",188
2021-02-12,08:27:42,albertbourla,"We’re working non-stop to ensure global supply of the Pfizer/BioNTech #COVID19 vaccine &amp; will continue to work with the @WhiteHouse to provide a total of 300M doses as soon as possible, so that 150M Americans can receive their first and second doses.  https://t.co/ssyWyGmuaQ",126
2021-02-12,08:20:54,gma,A new recommendation says to delay mammograms following the COVID vaccine. @DrJAshton has the latest.  https://t.co/l3NDG9G5zc,62
2021-02-12,07:19:54,gma,"Dr. Fauci says he believes April will begin ""open season"" for vaccines where anybody can get vaccinated.  https://t.co/KYnvMiYjxL  https://t.co/qk3D9gpRg4",113
2021-02-12,07:14:59,gma,New shot of hope as some major pharmacy chains start offering vaccines today. @WhitJohnson has the latest.  https://t.co/KYnvMiYjxL  https://t.co/7hdagyOnwt,67
2021-02-12,07:14:09,joncoopertweets,BOOM! Biden administration finalizes deal for 200 million additional vaccine doses from Pfizer and Moderna.  https://t.co/dFWzsSUVZQ,639
2021-02-12,06:58:47,forbes,"Last week, 793,000 Americans filed for unemployment benefits—there’s hope that Biden’s $1.9 trillion stimulus plan and vaccine rollout could be game changers  https://t.co/OTeXn4ULIw  https://t.co/gjH5jobStY",126
2021-02-12,01:57:42,kathbarbadoro,roses are red pit bulls are mean for the love of god give me the vaccine,164
2021-02-12,01:20:02,nbcnews,"President Biden announces that a deal has been finalized with Pfizer and Moderna to secure an additional 200M Covid-19 vaccine doses.   ""We have now purchased enough vaccine supply to vaccinate all Americans."" - @NBCNewsNow  https://t.co/LieuMByiBQ",1448
2021-02-12,01:00:00,cbsnews,Vaccine sites shut down as Biden promises more shots  https://t.co/AzGrkori9T,56
2021-02-12,00:58:19,anncoulter,"Oh she did not.  She was one of 6,000 research scientists at the N.I.H., which ""helped"" Moderna develop its vaccine.",600
2021-02-12,00:27:02,saharareporters,"Nigerian Scientists Will Soon Produce Coronavirus Vaccine, Science Minister Says | Sahara Reporters  Nigeria will no longer rely on other countries for the production of vaccines, as every country wants to produce their own. READ MORE:  https://t.co/qIxn2EsK1l  https://t.co/YRHdMXvzjS",239
2021-02-11,23:19:06,mattzeitlin,We desperately need this vaccine,406
2021-02-11,23:04:36,gma,TOMORROW ON @GMA: Dr. Anthony Fauci joins us LIVE to talk the latest on the dire COVID-19 vaccine distributions taking place from coast to coast.  https://t.co/JX466FsXbL  https://t.co/7x6cDi9DiN,113
2021-02-11,22:40:14,repsherrill,"Today I toured the Passaic County vaccination site in Woodland Park. Thanks to the County Commissioners, County Administrator DeNova &amp; Passaic Health Officer Dr. Gungil for running this site so well &amp; Mayor Kazmark for joining us. Find vaccine info here:  https://t.co/fubWKCTgbQ  https://t.co/ftVGZ9pQLK",86
2021-02-11,22:30:12,wsj,"Pharmacies and groceries across the U.S. say they are determined that no Covid-19 vaccine doses will go to waste, and are compiling wait lists and putting their own workers on standby in case extra doses are left unused at day’s end  https://t.co/PZA2HkU8bL",144
2021-02-11,22:21:08,nypost,Instagram yanks Robert F. Kennedy Jr.'s account over bogus COVID vaccine claims  https://t.co/2YqawW6KPr  https://t.co/FHx3Oza9H9,112
2021-02-11,21:48:41,stopantisemites,"Antisemitic flyers were found on a tram in Cologne, Germany, blaming Jews for the ongoing pandemic.  The flyer reads: “Do we really have a Corona problem? Or do we have a Jewish problem?” with a Star of David in the background.  When will we finally have a vaccine for Jew hatred?  https://t.co/uPzTnmdwDW",156
2021-02-11,21:40:04,nytimes,"The Biden administration said it had secured 200 million more doses of coronavirus vaccines, but President Biden warned that logistical hurdles would most likely mean that many Americans will still not have been vaccinated by the end of the summer.  https://t.co/NhExFmJSyN",1559
2021-02-11,21:22:22,michelleruiz,Weird inflection point. Vaccines are finally happening and numbers are coming down but ... it’s feeling as heavy as ever to almost everyone I’m talking to.,55
2021-02-11,21:02:54,kayleehartung,Dr Fauci says *BY APRIL* any adult in this country who wants a vaccine - regardless of age or health condition - will be eligible to get one,296
2021-02-11,21:00:06,unicefchief,"Today, @UNICEF has announced a new agreement on behalf of COVAX for the supply of Pfizer-BioNTech vaccines through 2021.   This is an important step towards making COVID-19 vaccines available and affordable to all countries.    https://t.co/4RZreiE9GO",272
2021-02-11,20:58:56,kellymdoran,It’s that time of year again...   Roses are red  Violets are blue Distribute vaccines faster  And more equitably too  #HealthPolicyValentines,126
2021-02-11,20:36:20,nygovcuomo,"Please join the NY Vaccine Equity Taskforce for their upcoming Fireside Chat tomorrow at 6:30pm ET.  Featuring @MARCMORIAL, Rev. Dr. W. Franklyn Richardson, Imam Abdul-Rahman Yaki &amp; Dr. Salvador Sabino.  Tune in tomorrow at  https://t.co/iYN7aqLjOy  https://t.co/YHYfqCVk2D",433
2021-02-11,20:20:02,rollingstone,Biden: US will have enough vaccine supply for every American by the end of July  https://t.co/NMIjUsfzjH  https://t.co/TjTw4pM5wW,185
2021-02-11,19:52:42,thedailybeast,Feds agree to buy enough COVID-19 vaccine doses for every American adult  https://t.co/Arnrs5Kw4A,116
2021-02-11,19:45:25,marketwatch,Moderna says U.S. bought 100 million more doses of COVID-19 vaccine  https://t.co/sHK1FIyRzD,234
2021-02-11,19:31:39,anildash,Deputize the Mister Softee fleet for vaccine delivery! 💉 🍦,265
2021-02-11,19:30:00,therecount,President Biden had a busy 24 hours while the country was transfixed by his predecessor’s impeachment — and he has 200 million new vaccine doses to prove it.  https://t.co/G7DbGJ28jo,7668
2021-02-11,19:24:37,msemilymccombs,Does anyone know what date sluts become eligible for the vaccine?,171
2021-02-11,19:09:11,virginiahughes,"This COVID-vaccine designer is tackling vaccine hesitancy — in churches and on Twitter, by @NidhiSubs  https://t.co/gXgsFj5gLU",101
2021-02-11,18:53:21,marcmorial,Tomorrow I'll host a fireside chat with faith leaders about overcoming #COVID19 vaccine skepticism as part of the New York State COVID-19 Vaccine Equity Taskforce fireside chat series. Please email questions to COVID19VaccineEquity@health.ny.gov. Watch:  https://t.co/yCLKLmoBRv  https://t.co/yokv2OuRMH,235
2021-02-11,18:43:00,cnbc,"President Biden announced today that his administration has secured deals for another 200 million doses of Covid-19 vaccine, bringing the U.S. total to 600 million.  https://t.co/DMvnkKz2qQ",126
2021-02-11,18:42:17,drtomfrieden,"Viruses, even with variants, are no match for very determined people (and vaccines).  https://t.co/NQqWUSwY77",114
2021-02-11,18:31:27,cnbc,"The White House has secured deals for 200 million more Covid vaccine doses. “Just this afternoon, we signed the final contracts for 100 million more Moderna and 100 million more Pfizer vaccines,” President Biden said.  https://t.co/hduoycyfHe  https://t.co/bNE9dOYFol",71
2021-02-11,18:20:00,loudwire,".@alicecooper gets COVID-19 vaccine, reveals he already had coronavirus:  https://t.co/P9mRP6L3iT",129
2021-02-11,18:13:44,biannagolodryga,"One year and one vaccine later, grandpa and grandson are reunited.  This calls for a special game of chess on a USA vs Soviet chess set.  🙏🏻♟❤️ (Cc: @Kasparov63 )  https://t.co/XPOMk2XKRN",3046
2021-02-11,18:08:39,marykarrlit,Ludwig sporting his new covid vaccine sticker. Makes him feel manly. Puts a spring in his step. Song in his heart. Watch out he's getting hopeful!👊🏻🫀🙌🏻  https://t.co/qxf11Cnhtg,88
2021-02-11,18:04:31,natesilver538,"In terms of thinking about vaccine skepticism, I think it's strongly preferable to use polls that allow people to be in a ""wait-and-see"" category rather than forcing them to choose yes or no. Only 10-15% of the country are hard no's.  https://t.co/vXXizHhI7s  https://t.co/SfsiHyu3Mo",475
2021-02-11,18:02:35,complex,Anyone who wants a vaccine should be able to get one by April 🙏  #ComplexNews  https://t.co/5vLj1Z20Qk,326
2021-02-11,18:02:03,armstrongdrew,"💉VACCINE DATA UPDATE (Feb 11)💉  🚀Big number day 🧵See thread link below about vaccine deals for 200M doses; good news on supply  📈2M doses today; 7-day avg=1.62M/day 🇺🇸US: 48M doses total 🧑‍🤝‍🧑35.7M people w/ at least 1 dose,🏅11.9M completed vaccination   https://t.co/5Of3UY74wf  https://t.co/xJObu5GAKE",719
2021-02-11,17:58:59,gugachacra,Biden says U.S. will have enough vaccine for 300 million people by end of July  https://t.co/WBNJeftD7L,159
2021-02-11,17:56:07,nbcnews,"BREAKING: US orders 200M more coronavirus vaccines, President Biden announces.  ""We're now on track to have enough supply for 300M Americans by the end of July.""    https://t.co/BGMdA97f1S",556
2021-02-11,17:55:13,tsrandall,"💉Vaccine Update (Feb. 11)💉 It was a big day for the global vaccine campaign—especially the U.S., where shots are now being given at an average rate of 1.6 million per day  🌏 159 million doses given worldwide 🌎 5.8M/day 🇺🇸 48 million doses  🇺🇸 1.6M/day   https://t.co/UU4DynjVvb  https://t.co/1tQFsovSnF",126
2021-02-11,17:52:39,armstrongdrew,"💉The U.S. has just announced deals for 200M more vaccine doses (100M Pfizer, 100M Moderna) for delivery by end of July.   🚀The U.S. has now climbed our ranking of vaccine deals, with more vaccine per capita arranged for than all but four other countries   https://t.co/ViL3AArvU3  https://t.co/DoutoW1X6M",97
2021-02-11,17:51:44,natesilver538,"But as @ScottGottliebMD and others have noted, we're going to go from scarcity to abundance sooner than I think people are realizing. Hope the WH is hard at work on plans on how to reach vaccine-skeptical and disadvantaged groups. Or thinking about shipping excess doses abroad.",1043
2021-02-11,17:46:42,marisakabas,vaccine trucks on every corner,183
2021-02-11,17:45:10,nypost,"US has now purchased enough COVID-19 vaccines for 'all Americans,' Biden says  https://t.co/ck1gKb6JmO  https://t.co/22iLbqao4L",409
2021-02-11,17:43:56,nbcnews,"President Biden greets Kizzmekia Corbett, an immunologist with the Vaccine Research Center, at NIH on Thursday.   Corbett's team began first-stage clinical trials in March 2020 and helped develop coronavirus vaccines.  📷 Evan Vucci / AP  https://t.co/xXpWYa3JOI",419
2021-02-11,17:41:05,pete_forester,@EWErickson I mean Biden just secured millions of doses of vaccine that Trump had cancelled the orders for. So... maybe they're right?,62
2021-02-11,17:40:01,epochtimes,"“At this time, we have not found a causal relationship,” said a @US_FDA spokesperson.  Authorities are investigating after some who received the #Vaccine for #COVID19 developed a rare blood disorder, with at least several cases resulting in death.  https://t.co/lUlAAO5M7f",60
2021-02-11,17:38:35,amy_siskind,Biden administration also has increased the vaccine supply to 1.5 million per day.,692
2021-02-11,17:37:18,amy_siskind,Biden announcing his administration has signed contracts for an additional 200 million vaccines by Pfizer and Moderna by July - meaning all Americans 16+ will be vaccinated.  Also speeding up earlier order for 100 million to May.    Thank goodness we won the election!,3331
2021-02-11,17:34:00,dailymail,Joe Biden says US has bought enough vaccines to give 300 million people shots by JULY  https://t.co/B0uDb6tNN4  https://t.co/tnkXkxUAeY,67
