date,time,username,tweet,likes_count
2020-10-12,14:33:01,rontkim,"Governor Cuomo,  My uncle was a US Army veteran who died alone in a nursing home with no funeral arrangements.  We are never going to be “better or stronger” from his and the 33,000+ COVID deaths in New York.  Please stop what you are doing.",790
2020-10-12,13:47:19,evanromano,hot damn HOST on @Shudder was the best produced-during-covid thing I’ve seen and also let’s normalize 56-minute movies,148
2020-10-11,20:35:30,lipiroy,"MASKS &gt;&gt;&gt;&gt;&gt;&gt; vaccines.  Why?  Because the former is effective at reducing viral transmission &amp; saving lives. The latter is nonexistent as of this moment when &gt;55,000 new COVID-19 infections emerge each day.  #wearamask #PhysicalDistancing",111
2020-10-11,11:05:32,realdrgina,"I am disgusted by the worst @CBSSunday ever...  They literally lifted up #China as the beacon of #Covid perfection - get this...   Because people in China are more COMPLIANT!   Sweden did no lock down or mask mandate w/best results.   Advocating tyranny is a new low, even for CBS",205
2020-10-11,09:23:31,baileycarlin,A COVID positive Titans Player or coach showing up to the facility every day  https://t.co/mMSJ9a63ZR,145
2020-10-10,20:34:35,yeampierre,"When I had Covid , I heard the incessant sounds of ambulance sirens outside my bedroom window as I laid shivering, terrified I would be carried out in one &amp; never return -they are back &amp; each triggers a prayer &amp; fear. Please do everything necessary to keep yourself &amp; others safe.",102
2020-10-10,16:10:09,thevikaskhanna,I am being honored by @RuchiraGupta @apneaap on #DayoftheGirl along with @GloriaSteinem &amp; #LastGirl champions. #1MillionMeals in Covid. . Free Registration  https://t.co/j4Vabq37Hc Oct11 8 pm New York.  See you soon.  https://t.co/MF56ysjn1L,259
2020-10-10,09:33:26,rubycramer,"Booker’s chief of staff, Matt Klapper, has had to interrupt him during or between meetings “to let me know, ‘Hey, this colleague of yours has COVID,’” so that in his next Zoom, “people aren’t telling me the news,” he said. “It is almost comical.”  https://t.co/q7omNQs5gX",124
2020-10-08,15:32:01,airlineflyer,"That's good. But what about transportation to the airport, security, hours inside the airport, cramped bus gates, hotels, restaurants...the list goes on. Your time on the aircraft may be relatively safe but the whole travel process has endless opportunities for COVID transmission",72
2020-10-07,22:25:53,tomwatson,Is some Trump Covid spreader coughing in the room? 😬,71
2020-10-07,22:22:58,jason_blum,That poor fly now has THE COVID!!!,522
2020-10-06,23:26:23,jewdygold,BREAKING: #StephenMiller diagnosed with coronavirus strain known as COVID-666.,2997
2020-10-06,23:10:15,yeampierre,"I can’t say Covid is hurting Latinos most when Black &amp; Indigenous communities have been devastated - go ahead &amp; disown me, but these are our peeps &amp; I won’t participate in oppression olympics-we are ppl of African &amp; Indigenous ancestry too, why is comparison even a thing-lets not",80
2020-10-06,22:10:43,georgehahn,"The president has COVID-19, has likely infected others with COVID-19, will likely infect more with it, and is spending the evening Mean Girl tweeting.",331
2020-10-06,21:11:45,marlownyc,remember when stephen miller’s own grandmother died of covid and he lied about it to protect trump  https://t.co/o1QL0J5e3s,200
2020-10-06,21:06:31,lipiroy,"@AliVelshi The White House is the epicenter of the epicenter of COVID-19 infections and deaths. The U.S. leads the world in both categories, by a large margin.  Make America Great At ...  spreading a lethal disease.",151
2020-10-06,19:15:09,georgehahn,And now Stephen Miller has tested positive. As if Trump’s White House were a whore house and COVID were crabs.,710
2020-10-06,17:35:03,martinezmau,La viuda de Nick Cordero (actor de Broadway quien murió de Covid a los 41 años) tiene un mensaje para @realDonaldTrump    https://t.co/EK830ggTsY,85
2020-10-05,22:58:24,martinezmau,"The whole world is in the middle of a pandemic. Mexico has over 80,000 deaths due to Covid (we know they’re at least twice as much but that’s another story...) and... Oh, why not? Here’s the Mexican President being a complete ass. Playing baseball. 🙄  https://t.co/bxMrXQbB6w",659
2020-10-05,22:49:35,airlineflyer,"2020, where instead of hitting refresh over and over to select a better seat for an upcoming flight you're refreshing the rapid COVID test appointment page because you were in proximity to someone else who tested positive.",96
2020-10-05,20:28:38,stevenmazie,"BREAKING: SCOTUS reinstates witness requirement for South Carolina mail-in ballots, blocking lower court order that had waived requirement due to COVID-19.",254
2020-10-05,19:27:11,andrewsolender,"""I saw a tweet he did, they showed me that said, ‘Don’t let COVID control your lives,’” Joe Biden tells @WPLGlocal10.  “Tell that to the 205,000 families who lost somebody.”  https://t.co/2Kn74nqh4i",3349
2020-10-05,19:14:07,nypddca,Today @StPatsNYC @CardinalDolan presided over a memorial mass as we mourned the loss and honored the lives of the 46 members of the @NYPDnews lost to the #covid_19 pandemic.   We will always remember their commitment to duty and vow to #neverforget our #fallenfinest  https://t.co/tqDDFibZID,120
2020-10-05,15:09:24,nypdshea,Today we came together to remember &amp; honor 46 of our brothers &amp; sisters who lost their battle with #covid. Their names &amp; memories will live on as we honor our vow to #neverforget.  https://t.co/nVgGdogVsL,110
2020-10-05,15:05:32,marlownyc,trump going back to the white house while still COVID contagious and his team allowing it to happen is some serious jonestown shit,127
2020-10-05,10:06:09,nypdnews,WATCH LIVE as @CardinalDolan hosts a memorial Mass to honor the 46 members of the NYPD who have died due to COVID- 19 related illness.  Follow this link ➡️  https://t.co/sDiJbrfszt  https://t.co/0TUBONxd6v,126
2020-10-05,01:40:26,yuhline,"We are usually not prepaid. Only 18 other states are. We asked the governor to do prepaid postage because of covid. So he did EO to have postage prepaid for requesting the ballot and some ballots had prepaid envelopes. But the EO didn’t include general, and now it’s too late.",69
2020-10-04,20:02:13,wallerabc7,Did you see that video? Pres. Trump In the car with secret service. I had covid. I still tested positive A MONTH after symptoms started. Will the secret service in the car with him now have to quarantine?,78
2020-10-04,18:36:30,markgongloff,Exposing Secret Service agents to COVID so he can wave at some Nazis real quick,110
2020-10-04,12:42:01,joeborellinyc,"I feel like these mini covid zip code-sized shut downs show a real lack of understanding of how automobiles, passenger buses, and railroads work.   Won’t asymptomatic folks from “hot zones” just go to restaurants and stores in neighboring areas, just blocks away?",1273
2020-10-04,09:20:49,glennemartin,I really don’t understand what the US government is doing to prepare for the second wave of COVID. Operation Wait and See? 🦠,70
2020-10-03,21:45:40,grace_panetta,"We're paying a lot of attention to Trump's case, but the US just recorded the most daily COVID-19 infections in nearly 2 months  https://t.co/PW5eFTeDQd via @usatoday",2601
2020-10-03,18:13:32,rubycramer,"The day after he said he received two negative COVID tests, Joe Biden opted not to get tested again today. “But I am tomorrow morning,” he told reporters in Delaware after attending mass services indoors. (per @IsaacDovere pool report.)",110
2020-10-03,12:50:28,rudygiuliani,"Biden flunkies trying to put off VP debate using @realDonaldTrump getting COVID.   It shows how afraid they are of Kamala Harris getting beaten as bad as Biden coming in third in last debate.  Of course, they are also trying to get out of next Presidential debate.",17792
2020-10-03,12:03:43,yosoymichael,Teen pop star Ashley O. has tested positive for COVID-19.,1384
2020-10-03,12:00:14,timfullerton,If this is true - the President went to events without a mask - all while knowing he was positive for COVID.   This needs to be the end of his presidency.,69
2020-10-03,11:27:54,marlownyc,"trump camp won’t even tell the american public when they get COVID. hope hicks was reported, WH staffers reported, trump/melania waited who knows how long to reveal, amy coney barrett now somehow claiming she had it months ago, kellyanne outed by daughter on tiktok...",129
2020-10-02,20:36:42,richardgarriott,"So @POTUS &amp; family arrive too late to the debate to be tested on site, just trusted them to say they were Covid free, then they were asked to wear masks as agreed, but they declined. Worse than assholes, literally wicked, selfish, stupid, murderous behavior. Vote them out!!!",63
2020-10-02,20:28:03,timfullerton,Two members of the Senate Judiciary Committee currently have COVID-19. There is no way hearings can begin on the 12th.,106
2020-10-02,20:26:04,timfullerton,"Now that we know that Thom Tillis has featured positive for COVID-19, the Senate has to shut down immediately. Confirmation hearings need to be canceled.",125
2020-10-02,20:13:57,grace_panetta,Tillis is the second GOP member of the Senate Judiciary Committee after Mike Lee to announce a positive COVID-19 test today alone,87
2020-10-02,19:01:35,marklevinenyc,"Pres. Trump is one of 30,742 Americans currently hospitalized for Covid-19.  We wish every single one of them a full recovery.",271
2020-10-02,14:35:09,glennemartin,COVID is about to humble Republican leadership. #BeStill,66
2020-10-02,12:19:47,andrewsolender,NEW: statement from @JoeBiden’s physician says he tested negative for COVID:  https://t.co/hZDPnhAA0J,69
2020-10-02,11:54:17,jaydestro,"Even on the day their god king gets covid, nypd refuses to wear masks in public.",65
2020-10-02,11:39:38,thevikaskhanna,"On auspicious occasion of Mahatma Gandhi’s Birthday, I’m honored to receive BSI, Covid Warrier Award from Mr. Amitabh Bachchan for my #FeedIndia campaign.  Thank you @ndtv @PrannoyRoyNDTV , @DettolIndia @SrBachchan  Banega Swatch India Jai Ho.  #SwasthyaMantra  @banegaswasthind  https://t.co/E4OfqXNpqO",529
2020-10-02,10:45:50,mattjpfmcdonald,a few options to consider this morning before sending your trump covid tweet  https://t.co/k5kuqlQVl3,187
2020-10-02,10:04:13,baileycarlin,"I am very curious as to how Trump handles surviving Covid. Will he say it isn’t a big deal and most people get over it easily, or will be commend his own personal strength and prop himself up as the pinnacle of health?",190
2020-10-02,10:03:03,brettsvergara,‘Trump got COVID’  https://t.co/SgbP75YrVl,617
2020-10-02,09:03:09,baileycarlin,Trump getting COVID after months of downplaying it  https://t.co/DXYShyEwXv,941
2020-10-02,02:16:59,yuhline,Trump and Melania test positive for COVID-19.,69
2020-10-02,02:07:01,rolandscahill,I think we all should have as much empathy for Trump as he has had towards every other COVID victim,1245
2020-10-02,01:43:16,rolandscahill,"Atheists are now questioning their faith, now that Trump has been diagnosed with covid",983
2020-10-02,01:42:44,grace_panetta,I really wonder if/how Congress is going to go about 1) confirming a Supreme Court Justice before the election and 2) trying to pass another COVID-19 relief bill after this,129
2020-10-02,01:21:21,stevenmazie,"This is a crisis. America’s president and untold others in the WH could get sick or die. Or those testing positive could have mild cases, recover, and declare anew that COVID is nothing to worry about.",136
2020-10-02,01:16:32,marklevinenyc,"Today 46,398 Americans tested positive for covid-19. Two of them are Donald and Melania Trump.   I wish everyone one of them a speedy recovery.",118
2020-10-02,01:06:40,pkhakpour,There is something suspicious about Trump reporting Covid positive on Oct 1—I know people are partying but Oct Surprise is a real thing &amp; I wonder what narrative he will try to sell now that he is more desperate than ever for votes.,210
2020-10-02,00:08:15,marlownyc,Today: *Trump prankster Jacob Wohl charged *Trump press sec causes Fox News’ WH reporter to lose it *Trump campaign finance chair accused of serial sexual harassment  *First lady shits on Christmas *Trump sr adviser has COVID *Trump and first lady quarantining,108
2020-10-01,22:36:22,timfullerton,The fact that the President of the United States is waiting for the results of a COVID test tells you everything you need to know about how he handled the response to this virus.,163
2020-10-01,09:40:19,baileycarlin,You mean they weren’t planning on curing COVID between Sunday and Tuesday?,75
2020-10-01,08:41:18,louispeitzman,"Republicans: Pre-existing conditions aren’t a thing. Also Republicans: COVID deaths aren’t COVID deaths, they’re the result of pre-existing conditions.",377
2020-09-30,12:21:09,marklevinenyc,"NYC has 3,600 contact tracers. The official answer to how many of them speak Yiddish is: ""between 0 and 5"".  Yiddish is the 7th most widely spoken language in NYC, and even more prevalent in some of the neighborhoods now being hardest hit by covid. We need to do better than this.",212
2020-09-29,21:42:49,derekblasberg,“I brought back football” is not a Covid-19 recovery plan,726
2020-09-29,21:34:57,marklevinenyc,"The idea that a re-elected Donald Trump would be in charge of the production, distribution, and administration of covid vaccines for 330 million Americans is utterly terrifying. #Debates2020",262
2020-09-29,21:29:23,tomwatson,Covid section is a huge win for Biden.,177
2020-09-28,20:46:50,drkimsue,"NYC COVID cases ticking up, especially in Brooklyn. Getting emails asking about my ability to serve in the medical reserve corp. We in NYC have been through a collective trauma from March-onward. It’s very rough facing the fall and winter of 2020, which seems already upon us.",263
2020-09-27,10:28:47,marklevinenyc,Twitter lets you see the lists people have added you to.  Some of those I'm honored to be included in:  Leftist propaganda bots Fake News hacks Constitutional Illiterate Firearm Phobes ToxicSJWs Covid misinformation Turtles all the way down  And my personal favorite: CelebriTards,89
2020-09-27,00:33:06,martinezmau,"Verástegui no es “la voz” de los latinos en E.E.U.U. Ser “pro vida” no es suficiente para votar por un misógino, violador, corrupto y mentiroso narcisista responsable de más 200,000 muertes por su pésima estrategia ante el COVID. Vivo en la ciudad que mejor conoce a ese rufián.",897
2020-09-26,16:21:15,tomwatson,Who could possibly have predicted that Covid cases would surge nationally a couple of weeks after schools and colleges opened? 🤔,11848
2020-09-26,09:42:53,timfullerton,"And if you’re one of the 7,000,000 who have/had COVID-19 - you have a preexisting condition for life.   You will lose your insurance if you rely on the marketplace for coverage. And you won’t be able to get it ever again.",2017
2020-09-26,09:07:07,sonalibasak,I miss life before Covid.,147
2020-09-26,08:00:48,airlineflyer,"A year ago today I started my last real vacation, flying LGA-DTW-ICN-HAN with Delta.  Today, because of a nearly complete lack of federal action and coordination to stop the spread of COVID while the President lied about how serious it was, I can't even go to Vermont.  Vote.  https://t.co/19dfWtByeL",529
2020-09-25,21:38:42,uche_blackstock,We must ensure a COVID-19 vaccine is submitted to the FDA w/ adequate data on safety &amp; effectiveness &amp; is reviewed properly by the FDA. We can’t accept anything less. Proud to sign this letter to @pfizer CEO &amp; Board with Eric Topol &amp; 58 other public health experts &amp; physicians.,254
2020-09-24,17:58:09,rontkim,"Gov Cuomo once again went on the attack, blaming the President &amp; Mayor for everything that went wrong. Sure, they made mistakes.  But it was the governor who transferred 6,400 COVID patients to unprepared nursing homes &amp; handed out get-out-of-jail-cards to his friends.",944
2020-09-23,22:33:31,randyrainbow,Oohhh bishhh look who dropped by for COVID cocktails!!!  https://t.co/nolWpCjahW,12640
2020-09-23,16:09:29,airlineflyer,Is there any recent airline related news that isn't about COVID or entirely depressing? Asking for a podcast co-host.,110
2020-09-22,12:39:38,martinezmau,"200,000 muertes por #Covid_19 en Estados Unidos. 💔",88
2020-09-22,09:10:05,billehermann,"‘Covid-19 has laid bare the world’s fragilities, inequalities ... people are hurting, our climate is burning.’ 🇺🇳 @un SG @antonioguterres opens #UNGA historic 75th session; reminding us that the world needs #Solidarity. I hope the 🌏 is listening. 🇩🇰 is.  https://t.co/arWpFVFJq5",66
2020-09-17,20:30:27,rolandscahill,"After watching this town hall, Trump is going to fake a COVID diagnosis to get out of debating Biden",1672
2020-09-17,14:43:40,yuhline,"The predatory loans that these drivers were given are trapping them in a cycle of debt they cannot get out of. With the shut down from covid and no income for months, the confessions of judgements they were forced to sign to get these loans is also being enforced. Traps closed.",106
2020-09-16,07:21:26,nbsaphiermd,Eli Lilly reports a reduced rate of hospitalization for COVID-19 patients using its antibody treatment.,956
2020-09-15,10:54:38,aliwatkins,"The more I’ve incorporated New York’s free Covid testing into my routine, the more perplexed I am that widespread, accessible testing continues to be elusive, six months into this.",127
2020-09-13,19:16:30,airlineflyer,"I'm so torn on these.  Pro: Other countries have COVID somewhat under control and can do fun things Con: Needless CO2 emissions for an industry already under a microscope Pro: Planes need occasional flight time, anyway Con: Still an unnecessary COVID spread risk Pro: Airplanes",63
2020-09-12,21:38:00,tsamaradki,"Apakah benar PSI tidak pernah sama sekali melontarkan kritik ke pemerintah pusat? Faktanya pada awal April, PSI pernah menuliskan surat terbuka mengkritik kebijakan Menkes Terawan dalam menagani Covid-19 sekaligus memberikan rekomendasi.  https://t.co/z6awCcFFqJ",243
2020-09-11,09:11:04,tsamaradki,"Fraksi @PSI_Jakarta mencatat 10 kesalahan Gubernur Anies Baswedan dalam menangani Covid-19, mulai dari telatnya melakukan SWAB hingga contact tracing per kasus yang terlalu sedikit.  https://t.co/xezezXCTDb",1389
2020-09-11,03:27:50,glennemartin,"9/11  I was close enough to hear the 1st plane go thru the building, then I watched the 2nd plane crash. I watched the buildings implode. Things would never be the same. That was true. And that was okay.   Things will never be the same after COVID. That is true. And that is okay.",56
2020-09-10,20:24:01,whitneyarner,"many have said but I wanna emphasize that with COVID the two scenarios are not ""you die"" or ""you get better and are fine."" it's six months later and I'm still absolutely getting my ass kicked with problems I didn't have before",153
2020-09-10,15:54:20,nick_ramsey,... trump one day after we learned he purposefully misled the nation on the risks of covid-19: “biden is perfectly happy to endanger the lives of other people by doing something that he thinks is going to help him politically.”  https://t.co/P5BcA6LkLw,124
2020-09-09,23:01:32,louispeitzman,I wonder if there’s any correlation between the people he dismisses as agoraphobic and the fact that there hasn’t been a COVID surge here. Makes you think!  https://t.co/cb9upY0m9k,213
2020-09-09,12:29:20,marlownyc,"Novak Djokovic—who hosted a pandemic tennis tour, went COVID clubbing, and started a tennis men’s rights org—is the biggest jackass in pro sports  https://t.co/CcYcpkWFjU",182
2020-09-07,11:53:55,alison__berg,"So my sister has covid-19 (she’s fine, but still) and her work, @innoutburger, which supposedly “cares a lot about its employees,” is trying to make her come in and that just seems like a major hazard to me?",71
2020-09-07,11:31:17,marlownyc,Workers (and their worried spouses) tell @tarpleyhitt that Disney is covering up its COVID-19 cases and clearing workers who contract COVID to go back to work after just 5 days (and no negative test)  https://t.co/YPoixdJZ7B #LaborDay,100
2020-09-03,08:34:03,jaydestro,@NickAshleyCook @bomani_jones If my uncle worse a mask in march he wouldn’t have caught covid and died.,89
2020-09-02,12:03:13,drjohnny__,Imagine Ivanka Trump got her hair done. Inside. Without a mask on. In COVID-ridden California.   Mind-blowing hypocrisy.,1594
2020-09-02,00:44:22,martinezmau,Good news.  Ha valido la pena cuidarse tanto estos meses.  No he tenido Covid. 🙏🏼 ...a seguir cuidándonos.  https://t.co/I2ebPg7n7Z,302
2020-09-01,17:07:26,katehinds,COVID-free torsos—come and get them  https://t.co/pQHZ9RpZWi,94
2020-09-01,16:32:04,countessluann,"Yes we’ve all tested negative for Covid! 🙌 So proud of @Jillzarin &amp; allyshapiro for creating these awesome masks. For every mask sold, one is donated to a #healthcare worker! See the masks &amp; where to get them in my…  https://t.co/I4TZOuAU5P",127
2020-09-01,10:26:39,martinezmau,"Had my Covid test done yesterday. It took a while to decide what box to check when they asked for my race. It seems America hasn’t decided you can be Hispanic and/or Latino (which is my ethnicity) and be white (the color of my skin). Oh, and Hispanic White is trending on twitter.",248
2020-09-01,08:27:19,aronczyk,Times When NYC Was Declared Dead Since I Moved Here:  2001 - 9/11 2003 - Blackout (maybe that was “NYC is Dark” not “NYC is Dead”...?) 2008 - Great Recession 2012 - Superstorm Sandy 2020 - COVID  Did I forget any? I’m losing track    https://t.co/Xv49YCuI9O,159
2020-08-29,11:37:43,celinegounder,Science not spin will allow us to vanquish COVID.,355
2020-08-29,11:37:21,tomwatson,My biggest Covid fear is - and has been from the beginning - giving it to someone else. Impossible to live with.,119
2020-08-27,14:54:23,nick_ramsey,"... eric trump on democrats: “all they can talk about, steve, is covid. covid, covid, covid!”  the confirmed u.s. death toll from covid-19 is over 180,000 people.  https://t.co/b3hnVEFtm7",5295
2020-08-26,17:27:17,nypd19pct,Got em! Wanted for numerous residential burglaries &amp; out on parole due to COVID-19 concerns—a career criminal is now back behind bars!  Huge thanks to a community member for alerting us after spotting him entering an apartment &amp; superb work by all our officers for a swift arrest!  https://t.co/VnS24QO3rh,137
2020-08-26,01:24:53,drjohnny__,“Hydroxychloroquine may reduce symptoms of COVID-19.” - @DonaldJTrumpJr suspended from Twitter  “Attack innocent cops.” -@shaunking totally fine,741
2020-08-23,20:48:49,roncoleman,"I'm in Boro Park, Brooklyn - world headquarters of the completely and vividly woke attitude toward #Covid",141
2020-08-22,16:50:09,tkylemac,"175,000 dead and still no plan for COVID-19 but the White House had time to pluck out a few trees and renovate the Rose Garden? Cool.",366
2020-08-21,21:53:25,_erichu,First haircut since covid!!!  https://t.co/IUayikx97S,215
2020-08-18,12:32:18,louispeitzman,Writing a book about containing COVID when you’re still in the middle of the pandemic... do you live off of “this didn’t age well” replies?,86
2020-08-18,11:14:47,eboland11,Thank goodness even in this COVID-shortened season there’s still ample opportunity for baseball to throw up all over itself with a good old fashioned “unwritten rules” controversy.,118
2020-08-18,10:29:03,jee_vuh,In 60 years there’s going to be a quarantine American Girl Doll called like Addison and she’ll be orphaned after both her parents die of COVID but then learn a heartwarming lesson about community by volunteering with her local mutual aid network and leading the 7pm clap.,47
2020-08-17,19:31:47,drjohnny__,"I had a joke about COVID, but there’s a 99.98% chance you won’t get it.",15670
2020-08-17,18:50:36,martinezmau,"Ah, caray... Más de 56,000 mexicanos muertos por #Covid y esta mujer tiene el descaro, la desfachatez y el cinismo de responder: “la cuarentena ya se acabó”. La NO primera dama @BeatrizGMuller cada vez se vuelve más déspota y el pueblo bueno y sabio lo sabe. #LopezNoCumple  https://t.co/600P0nvkc9",1748
2020-08-17,07:45:56,dcampoamor,Yesterday the president RTed a tweet that read “Leave Democrat cities Let them rot” &amp; we all collectively went 🤷🏽‍♀️ because he already left people living in blue cities &amp; states to die of COVID &amp; we’ve become so desensitized it’s just accepted as normal but it’s not omg it is not.,2318
2020-08-16,21:21:30,thisisrobthomas,"After 6 months, multiple Covid tests and much quarantine time we finally got to see dejanstanjevic michelle.r.leon and beautiful little Maya. We played some music together and her and her  Titi  Mari were color…  https://t.co/p1cptZurSK",488
2020-08-16,17:00:10,airlineflyer,"Walked the South Portland Open Street in Fort Greene and about half of all the parked cars were brand new 2020 models, many so new they still have temporary registrations.  This is all on @NYCMayor's complete failure to do anything regarding transportation in response to COVID.  https://t.co/2WCoTbpqrL",123
2020-08-15,10:19:15,jimmyvanbramer,"The union representing NYC police officers endorses Trump, a racist, a proud white supremacist fascist for president. A man responsible for the response to the COVID pandemic that has killed so many who did not need to die in NYC. What a disgrace. #BlackLivesMatter #DefundNYPD",157
2020-08-15,01:13:00,rosebudbaker,Eating pussy cures covid just FYI folks we could wrap this up tomorrow,1119
