date,time,username,tweet,likes_count
2020-06-29,22:55:09,mjfree,Turns out Feb was a big month for Donald. He ignored both Russian bounties AND the coronavirus.,233
2020-06-29,22:02:50,martinezmau,🇨🇦 | CANADÁ  El Cirque du Soleil se declara en quiebra y despide a casi 3.500 empleados a causa de la pandemia. Solicita una reestructuración de la deuda. #cirquedusoleil #cirque #coronavirus #bankrupt #Covid_19,1074
2020-06-29,20:18:33,mjfree,Leaving battling coronavirus “up to the states” will be Trump’s Achilles heel. Just can’t cover that one up. We needed leadership and a national response. We got a racist who left Americans to die.,324
2020-06-29,17:42:01,uche_blackstock,"Black people are only 1.6% of the population of Maine, but account for more than 22% of #coronavirus cases in the state.    #structuralracism #healthinequities",524
2020-06-29,14:00:44,pbump,It seems that no other country has mirrored the U.S.'s up-then-down-then-up-again coronavirus pattern — probably in large part because no other country operates quite like the U.S.  https://t.co/TIgz8DeGIG,96
2020-06-29,08:37:39,uche_blackstock,"I miss going out to brunch too, but stay away from indoor dining at bars and restaurants. It’s the perfect conditions for becoming infected with #coronavirus. Indoors with poor air circulation, people eating, talking and yelling loudly and in close proximity to each other.",1315
2020-06-29,07:39:08,uche_blackstock,This entire article features quotes from government officials with no public health or healthcare background telling public health experts that they’re wrong about the #coronavirus crisis.   https://t.co/QRuiADl4FL,83
2020-06-27,12:28:19,chayesmatthew,"“Cuomo, you lied! You left our seniors to die!”  — Alexa Rivera, administrator of a Facebook group for people whose loved ones died of coronavirus at NY nursing homes/rehab centers, leads a chant outside the governor’s Manhattan office. About 50 from the group joined the rally.  https://t.co/LT8FeeHKi3",77
2020-06-27,12:17:51,chayesmatthew,"“They are not numbers! They are human beings!”  — Theresa Sari of New Jersey, whose mom, Maria Sachse, 60, died of coronavirus at a nursing home in Island Park.   “Anyone with common sense could have predicted the deaths of all these people — vulnerable people.”  https://t.co/5KZX9Vxd7R",89
2020-06-27,11:52:25,chayesmatthew,"“CUOMO  KILLED  MY MOTHER”  — Haydee Pabey of Westchester, a police officer, whose mom, Elba, died April 6 of coronavirus at a nursing home. She came to this demonstration outside @NYGovCuomo’s office with a copy of his order ordering nursing homes to accept coronavirus patients.  https://t.co/fAvku0GrKq",123
2020-06-27,11:47:12,chayesmatthew,“Their lives mattered!”  “We want answers!” — demonstrators outside @NYGovCuomo’s Manhattan office who blame him for ordering nursing homes to accept coronavirus-positive patients (where other patients could be in turn infected)  https://t.co/6JpYWfZVbu,197
2020-06-26,13:22:23,lipiroy,"""We are facing a serious problem in several parts of the country. When you have an outbreak of an infectious disease, it's GLOBAL. We are an interconnected society. If you get infected, you're playing a dynamic role in spreading the disease."" -#DrFauci   #coronavirus #pandemic  https://t.co/BQUxMgG49b",626
2020-06-26,07:51:01,uche_blackstock,"“Asked whether it is more important to try to control the spread of the coronavirus or to try to restart the economy, even if one hurts the other, 83 percent of black Americans say trying to control the virus is a higher priority.”",107
2020-06-26,07:49:25,uche_blackstock,"“Nearly 1 in 3 black Americans know someone personally who has died of covid-19, far exceeding their white counterparts, according to a Washington Post-Ipsos poll that underscores the coronavirus pandemic’s profoundly disparate impact.”   https://t.co/bW7VexR5Xs",795
2020-06-24,19:14:27,jacobkornbluh,Are we ready to discuss Cuomo’s great handling of the coronavirus outbreak and how the slow opening process proved to be successful?,83
2020-06-24,14:00:55,uche_blackstock,Trying to decide if my biggest flex since leaving academic medicine was testifying in front of the U.S. House of Representatives Select Subcommittee on Coronavirus or today when a huge black Suburban picked me up from home to take me for an interview at @NBCNews studios? 🤔,1829
2020-06-22,13:23:57,pbump,"Since June 16, when Pence pointed to ""stabilizing"" coronavirus cases as evidence that things were going well, the daily average of new cases is up 18 percent.  https://t.co/UgQ0NVqVf6",546
2020-06-22,12:14:52,nick_ramsey,"... asked twice this morning by @joestgeorge if #coronavirus testing has been slowed down as trump said on saturday, the president twice dodged the question and again falsely said the u.s. case count is only so high because of testing.   https://t.co/6oeYinUTgi",205
2020-06-21,00:49:21,santos4congress,Interesting to see hashtags like “#TrumpsCoronavirusRally #TulsaDeathRally” trending. When vandals took over our cities and burned them to the ground it was not a health risk nor was #coronavirus a concern. #DoubleStandards #DemocratMobs #DemocratsAreDestroyingAmerica #MAGA2020,85
2020-06-17,16:59:21,baileycarlin,New York SLUTS against coronavirus  https://t.co/A6nOeljuNb,2850
2020-06-17,11:04:52,pbump,"For the past two weeks, more daily coronavirus cases have emerged in red states than in blue states.  https://t.co/QutVxZQGXZ",83
2020-06-16,19:28:53,uche_blackstock,"@LionBlogosphere @RheaBoydMD @trumwill You are not understanding. The piece is comparing mortality rates, not absolute numbers. Essentially, if a Black person even relatively young is infected with Coronavirus, they are up to 9 times more likely than their white peers to die.",361
2020-06-16,16:05:56,pbump,Pence wrote a piece in the Journal knocking down the idea we're seeing a second wave of coronavirus cases. He's right — but not for the reason he argues.  https://t.co/FhiZBKceOw,139
2020-06-16,14:21:41,mollyjongfast,Maybe if the head of the coronavirus task force would wear a mask it might be a good start,723
2020-06-16,13:49:48,mollyjongfast,The head of the coronavirus task force is not wearing a mask because of course he’s not.,4983
2020-06-16,11:18:37,mollyjongfast,I’m old enough to remember when Mike Pence was the head of the coronavirus task force. Oh wait,903
2020-06-15,23:00:54,mollyjongfast,Number of people dead of coronavirus in South Korea: 278,1202
2020-06-15,19:23:44,uche_blackstock,@ElieNYC Physician here. Wearing mask is fine. You don’t need to reheat the pizza. Very low rate of transmission of #coronavirus through food. Enjoy!,297
2020-06-15,16:30:55,mollyjongfast,The head of the coronavirus task force is lying or confused about coronavirus,16894
2020-06-15,09:06:56,leeabbamonte,"The reason #Covid_19 is still a thing in America is because we are undisciplined, uninformed, arrogant, non-unified and lack true leadership. Most other nations sucked it up, did the right thing and are now on the other side. This will be a long, sad saga in the US. #coronavirus",96
2020-06-14,00:02:07,mollyjongfast,We could really use a president who could unite us and a functioning federal government who could deal with coronavirus. We have neither.,5551
2020-06-12,21:35:06,mollyjongfast,"If we had a president who told people to wear masks, less Americans would end up dying of coronavirus",36268
2020-06-12,15:17:35,mollyjongfast,The head of the coronavirus task force is not wearing a mask nor are the people he’s sitting too close to. Ahhhhhhhhhhhhhhhh,9873
2020-06-12,12:22:56,mollyjongfast,The head of the coronavirus task force is neither wearing a mask nor engaging in social distancing,2065
2020-06-11,20:58:57,mollyjongfast,The GOP needed a safe space away from all those government officials who are trying to keep them from catching coronavirus.,554
2020-06-10,21:44:51,mollyjongfast,Remember coronavirus? The Head of the coronavirus task force doesn’t.,7385
2020-06-10,07:10:34,santucci,Coming up on @GMA - Dr Anthony Fauci - latest on coronavirus as states re-open and in some cases numbers going up — more at 730am,125
2020-06-10,03:20:45,stevescottnews,"Every morning at 2:30am, when my wife drives me to work, we pass by Lenox Health Greenwich Village Hospital on 7th Ave. For months, a refrigerated trailer was parked outside. We knew what was in that trailer. 😢  Now, that trailer is gone.  Progress. #NYC #coronavirus  https://t.co/pWCSd7A6Mt",66
2020-06-09,22:16:23,mollyjongfast,Turns out that coronavirus isn’t over just because Americans got bored with it.,7941
2020-06-09,13:52:04,uche_blackstock,Below is my statement from last week’s briefing to the U.S. #HouseofRepresentatives @COVIDOversight committee briefing on racial health disparities in the #coronavirus pandemic. Looking forward to sharing specific &amp; actionable recommendations with Chair @WhipClyburn.  https://t.co/v3SeL9ypPi,204
2020-06-07,09:05:43,cnyari,Impressed with how #Bundesliga keeps striving for progress and innovation:  - first top ⚽️ league to have a female referee  - first top league to integrate VAR - first major sports league to restart during the coronavirus lockdown   On top of already being the most fan-friendly.,155
2020-06-06,20:12:22,rlespinal,The fear of getting harassed by police officers after curfew has proven to be greater than the fear of corona virus. Workers have been hurting for months. The curfew is creating a bigger problem  https://t.co/A7RkCtBT16,103
2020-06-06,13:10:14,thereval,"NAN staff &amp; volunteers join me in giving out 3000 Meals at NAN’s House of Justice for those inconvenienced because of the coronavirus shut down. #Meals will continue to be served every Mon-Sat from 12pm-4pm, today is the 60th day &amp; over 500K meals served. Thank you @wckitchen.  https://t.co/fat0bHk7xL",144
2020-06-05,09:30:45,uche_blackstock,2/And then not being able to respond to correct the information. Even one of the Democratic Representatives suggested that Black people may have a genetic disposition to being infected with Coronavirus.,740
2020-06-05,09:29:31,uche_blackstock,"Y’all, I’m emotionally and physically depleted after speaking to the US House of Representatives yesterday, especially after hearing the misinformation from the Republican Representatives about Coronavirus and racial disparities.  1/",2761
2020-06-04,22:58:30,uche_blackstock,"(THREAD) 1/ At the height of the #Coronavirus pandemic, I was incredibly stressed seeing high volumes of COVID-19 patients and at the same time scared for my patients and my own safety.   It turned out to be a lesson in self-care.",244
2020-06-04,20:42:25,uche_blackstock,So this happened today. Auntie Maxine addressed me as ‘Ms. Blackstock’ during my testimony on racial disparities to the US House of Representatives Select sub-committee on Coronavirus.   She is the *only* person who I would not correct and say ‘It’s Dr. Blackstock’.,1071
2020-06-04,10:24:10,luisjgomez,Pointing out that George Floyd had coronavirus is like saying the World Trade Center had plumbing issues.,2389
2020-06-04,08:41:28,mollyjongfast,Must read thread about #blacklifematters &amp; #coronavirus 👇🏻👇🏻,243
2020-06-03,10:53:06,uche_blackstock,"Tomorrow, as I stand on the shoulders of my ancestors, I will be speaking as a witness at a virtual briefing on racial health disparities to the U.S. House of Representatives Select Committee on the Coronavirus Crisis.🙏🏿   https://t.co/8DQxfIf5OL",2799
2020-06-03,01:25:48,wajskhan,"#OnThisDay in 2020 - Current PM @ImranKhanPTI lifted lockdown &amp; told 220 million Pakistanis to “live with the virus”; also, as the planet battles a second wave of #coronavirus accompanied by protests, Khan announced the “opening” of tourism.  That’s right. Tourism. In a pandemic.",838
2020-06-01,07:25:24,slasher,"@ProSyndicate your two total tweets about all of this are 'but the looters' and 'but coronavirus', with no mention of police or seemingly a good understanding of why this is happening",1014
2020-05-27,20:02:56,martinezmau,Shit is real. Shit is getting real. Coronavirus...   https://t.co/yeLd1MhUpp,721
2020-05-24,21:14:30,roncoleman,Andrew Cuomo is no hero. He's to blame for New York's coronavirus catastrophe | Lyta Gold and Nathan Robinson  https://t.co/0yGP4Jjdn2,313
2020-05-24,09:42:24,timfullerton,"Seven weeks ago, South Korea had the same number of Coronavirus deaths as the United States did.",1792
2020-05-23,14:19:46,pbump,I wrote about Trump getting an all-clear to head to a problematic coronavirus region to play golf.  https://t.co/NxK5jIRuRw,578
2020-05-22,20:35:26,uche_blackstock,"Any large gathering is a recipe for increased #coronavirus transmission, especially at a time when some states’ cases are still increasing or have plateaued.",68
2020-05-22,07:15:08,uche_blackstock,ICYMI: Both the @CDCgov and several states have been inappropriately combining PCR and antibody test results creating for inaccurate testing data.   ✅PCR: tests for current #coronavirus infection  ✅Antibody: tests for past #coronavirus infection   https://t.co/z034ddWnGs,154
2020-05-19,15:01:52,pbump,"Two weeks ago, Laura Ingraham elevated an obviously wrong article suggesting that the number of coronavirus deaths had been overstated by the media. The data being used were incomplete — and now we can see just how wrong the claim was.  https://t.co/APK5PuqgEn",224
2020-05-18,18:37:51,louispeitzman,Carrying a megaphone to remind couples where a woman is wearing a mask and a man is not that coronavirus disproportionally infects men and makes them sicker. In a chill way.,96
2020-05-18,15:09:52,uche_blackstock,"LAPD already eats up 53% of LA’s gen fund. @MayorOfLA wants to increase police overtime funds 47%! That’s $200 million, at a time when crime is down 30% &amp; we need funds for services in the midst of #coronavirus crisis. @CD6Nury &amp; City Council we need a #PeoplesBudgetLA! @blmla",56
2020-05-17,09:06:58,errollouis,"What did we know, and what did we do about it? NYC’s Comptroller launches investigation into city’s coronavirus response  https://t.co/yMcET8u39J",67
2020-05-15,06:57:30,uche_blackstock,"C’mon, @nytimes. Stop erasing race.  The title should read “The Richest and Whitest Neighborhoods Emptied Out Most as Coronavirus Hit New York City.”  That’s what the data shows.   https://t.co/QDN3c8P9d2",533
2020-05-13,23:21:29,louispeitzman,"The WHO being like, you may have to learn to live with coronavirus, what in the buddy comedy hell...",100
2020-05-13,12:46:56,mjfree,Trump’s coronavirus strategy remains as it has been from the beginning: to treat this virus less seriously as the world and the experts predict it to be.,169
2020-05-13,07:23:30,uche_blackstock,Black people are being disproportionately arrested for social distancing ‘violations’ and then being put in jail where #Coronavirus is spreading like wildfire.   https://t.co/4rTZRk4wiX,540
2020-05-12,12:33:34,pbump,It's been obvious for some time that coronavirus deaths were being undercounted.  https://t.co/hhHJuHrDpc,140
2020-05-11,20:37:21,drdavidsamadi,Two staffers at the White House are diagnosed with #coronavirus. Does @realDonaldTrump need to wear a mask?  CNN is calling for him to wear a mask. I don’t think it is necessary. What say you ?  https://t.co/rP6QdiXfLF,172
2020-05-09,22:05:03,santucci,.@ABC News has confirmed Dr Anthony Fauci will begin a “modified quarantine” after some contact with WH staffer that tested positive for coronavirus via @rachelvscott &amp; me,250
2020-05-09,13:39:26,nouriel,Trump &amp; Pence should go into self-quarantine for the next 2 weeks according to the government's own coronavirus guidelines. More than a dozen people who may work near President Trump &amp; Vice President Pence have tested positive for the coronavirus this week  https://t.co/ZRUJkJyDNz,132
2020-05-09,11:22:37,santucci,"Aide to Ivanka Trump who tested positive for coronavirus is NOT a White House employee, sources tell me &amp; @KFaulders - works for the family personally and has not been anywhere near the West Wing or in contact w/ Ivanka Trump or her family for well over a month",242
2020-05-09,07:36:54,drdavidsamadi,#ReOpenAmerica @realDonaldTrump more people die from #heartdisease and #Cancer than #coronavirus. Delaying #elective-surgeries can become  a health crisis. @drdavidsamadi @mitchellvii @dbongino @DrMartyFox @kilmeade 🇺🇸🇺🇸🇺🇸🇺🇸🇺🇸🇺🇸  https://t.co/4hPA3E8quU,722
2020-05-06,16:34:07,johndevore,“Jared Kushner is a human champagne flute. He should not be running the nation’s coronavirus response. He was raised to play tennis and terrorize waiters who serve the wrong salad dressing.” @JohnDeVore  https://t.co/kjzMkqY9ww,71
2020-05-05,19:59:23,uche_blackstock,"Since folks are asking, I completely support my patients’ holistic practices and feel hopeful when I hear their #COVID19 symptoms have improved with herbs and acupuncture. There is so much we don’t know about #Coronavirus, but these practices have been around for eternity.",249
2020-05-05,08:11:26,louispeitzman,This headline is incredibly misleading. They are talking about... the current strain of coronavirus.  https://t.co/cjlahjj5fP,232
2020-05-04,10:05:38,asteadwesley,This will be the plot of Jordan Peele's eventual coronavirus movie,454
2020-05-03,21:15:26,drdavidsamadi,"Great news about #coronavirus #vaccine by the end the year. #ReopenAmericaNow safely. With remdesivir,vaccine and protecting elderly 🇺🇸🇺🇸🇺🇸🇺🇸will be bigger and better.God Bless America.  https://t.co/Eox1yrhnYn",95
2020-05-02,15:32:32,cleavon_md,"16,000 New Yorkers dead in 8 weeks! This is a SLAP in the face to healthcare providers nationwide risking their lives and dying on the frontlines of the coronavirus pandemic. I’m in Central Park right now and it’s business as usual.😷👋👋  https://t.co/RPdjciQVpx",12007
2020-04-30,11:40:05,gerardaraud,"Le DNI, directeur national qui coordonne les 17 services de renseignements américains, confirme que la communauté américaine du renseignement a conclu que le Coronavirus n’avait été ni créé ni génétiquement modifié par l’homme.",123
2020-04-28,15:47:56,pbump,I made a map of the counties with the highest per-capita rates of coronavirus infections. Most of them had either a prison or a meat processing plant.  https://t.co/haBVUl0KsD,173
2020-04-26,09:02:47,pbump,"Yesterday, Trump wondered why there should be coronavirus briefings if the media was going to ask tough questions. One answer, based on our analysis: Maybe the experts could weigh in more?  https://t.co/knXmq16rXf",78
2020-04-25,12:18:15,marklevinenyc,Yes it's true pre-existing conditions make you more vulnerable to coronavirus.  Pre-existing conditions such as not having health insurance.,176
2020-04-25,09:17:20,timfullerton,There is little to no doubt now that the Wisconsin GOPs actions to force the primary to go on April 7 has caused a dramatic spike in Coronavirus cases.   This should be the only the the press asks them about from here until November.,83
2020-04-22,11:32:38,patrickhinds,Listening to @AOC’s interview on @maddow from last night. Her district is the hardest hit IN THE COUNTRY by coronavirus. I’m basically a sobbing gay hysterical mess. She is the future. We might—MIGHT—be ok if we keep electing people like her to lead.,137
2020-04-22,10:07:31,johncraven1,"Greetings from Mt Sinai Hospital. Today I got tested for #coronavirus antibodies 💉 If I have enough, I’ll be able to donate plasma and hopefully help someone who’s really sick. Antibody results take a few days, in case you’re curious  https://t.co/XI9qTNAd48",94
2020-04-21,16:51:20,jacobkornbluh,"Bd”h: A second cousin of mine, Yochanan Hochauser, from Stamford Hill, London — a father of 12 — passed away due to coronavirus  https://t.co/RYTfjdQEtJ",123
2020-04-21,06:51:53,jan_ransom,"NEW: My Dad was the fourth resident of his nursing home (@HudsonPointe_HC) to get #coronavirus. No one told me about the first and a NY State Dept of Health policy did not require notification. That policy changed on April 4, five days before my dad died.   https://t.co/85oiSkQqnF",2346
2020-04-20,22:22:15,martinezmau,Seré breve:  El Coronavirus NO TIENE CURA. Ni con estampitas ni con oraciones ni vibrando alto ni nada de eso.  Quédate en tu casa. Punto.,532
2020-04-20,12:53:02,pervaizistan,"NEW: NYPD announces 30th employee dies of coronavirus.  In internal email shared w/ @CNN: “Mohammed, who would have marked 30 years w/ the NYPD next week, was very highly regarded–some say “revered”-by all of the uniformed and civilian members of our Transportation Bureau,” Shea",229
2020-04-19,20:16:15,kattimpf,Hey guys watch this tell me what you think it’s fun and has nothing to do with coronavirus,2503
2020-04-19,12:31:48,aaronlmorrison,"Look at Beyoncé, delivering facts on facts on facts about the coronavirus toll of black folks.  https://t.co/l55zJGWcP6",74
2020-04-18,20:21:10,uche_blackstock,"Why are we behaving like states have actual physical boundaries? If one state gets #coronavirus under control but the other 49 states have their own individual plans, ranging from reckless to weak mitigation strategies, we’re all in trouble! Am I missing something?",1193
2020-04-18,13:13:40,thereval,"Giving out 3000 Hot &amp; Cold Meals at NAN’s House of Justice for those inconvenienced because of the coronavirus shut down. #Meals will continue to be served every Monday-Saturday from 12pm-4pm, today is the 24th day, spread the word. Thank you to @wckitchen.  #operationfeedharlem  https://t.co/E7jqDnvUJt",267
2020-04-18,13:10:03,thereval,Rev. Reggie Bachus and NAN staff join me in giving out 3000 Hot &amp; Cold Meals at NAN’s House of Justice for those inconvenienced because of the coronavirus shut down. #Meals will continue to be served every Monday-Saturday from 12pm-4pm. @WCKitchen  #operationfeedharlem #nan  https://t.co/NGSUTe823Z,195
2020-04-18,10:29:49,marklevinenyc,Why don't you ever hear the # of people in NYC who have been infected with coronavirus?  Because we don't know. Lack of testing means we're only catching a small % of cases. Best guess for the full count:  ==&gt; 1 million  That's why you know so many people who have gotten sick.,254
2020-04-18,08:55:30,mattmfm,Trump’s approval hitting new lows.   Approval: down 10% ↓ this month    Handling of issues even worse.   Health care: down 11% ↓ Coronavirus: down 16% ↓ 🚨 Economy: down 8% ↓    https://t.co/nlVew71WGb  https://t.co/eZC6S75vpi,105
2020-04-17,17:15:49,martinezmau,"El alcalde de #NuevaYork #BillDeBlasio anunció que inmigrantes #indocumentados en la Ciudad de Nueva York afectadas por #coronavirus recibirán ayuda: $400 dólares por persona,  $800 dólares por pareja o padre soltero con hijos  $1,000 dólares familia con niños y adultos.🗽  https://t.co/QfjwNSokfA",185
2020-04-16,15:39:00,martinezmau,"Para los que critican como es que un país como Estados Unidos lidera en casos y muertes de #coronavirus, vean la población y el tamaño del país sobre Europa. Después vean el de México. No soy experto, pero yo no creo las figuras que el gobierno de México está dando. ¿Ustedes?  https://t.co/6hMYH2ghSI",166
2020-04-16,13:49:19,billehermann,‘A special meeting w/ special friends with special needs’. #Nordics 🇩🇰🇫🇮🇮🇸🇳🇴🇸🇪 &amp; @UN meet w/ #SIDS to discuss how @UN #COVID19 Trust Fund - supported by @DanishMFA - can help Small Island Developing States in fighting socio-economic impact of #coronavirus. #Together #Solidarity  https://t.co/BvOj81p69A,59
2020-04-15,08:35:27,reportertopher,Her husband was dying from Coronavirus. Her symptoms were worsening. One of her kids was showing symptoms. And now the state of New Jersey was telling her: Find someone to care for your sick kids or it would place the children. From me &amp; @DavidArmstrongX  https://t.co/9QXQWRj5N7,174
2020-04-14,14:43:01,shubasu,"A glimpse at my inbox, overflowing with original poems by @WNYC listeners for #NationalPoetryMonth, all shared with permission. ⬇️⬇️⬇️  Haiku by Jasper Cox (12 yrs old in Park Slope)  Coronavirus I can not believe that it Is five syllables",67
2020-04-14,06:51:56,bobhardt,Really important story about what doctors are learning as they fight the Coronavirus.,106
2020-04-13,16:01:43,uche_blackstock,One of the worst feelings has been having discussions with patients who  want #coronavirus testing but being unable to test them bc of limited supplies and bc they don’t fit high-risk #COVID19 criteria but you know the best public health intervention is to test *everyone*...sigh.,297
2020-04-13,16:01:24,jacobkornbluh,"Rabbi Avraham Pinter, an influential Orthodox Jewish leader from Stamford Hill, London, with close ties to the British Labour Party, passed away from coronavirus. He was the first rabbi to become a local councillor (in Hackney borough council) in 1982.  https://t.co/ZvSk11nOCj",392
2020-04-13,09:52:16,martinezmau,"Otro amigo se suicidó anoche. Sufría depresión y el encierro no ayudó.  Mi amiga con 30 semanas de embarazo, en el hospital con #Covid_19 con respirador.  Mi maestro de canto, murió esta mañana. #coronavirus   Y no para de llover en NY.  💔",5146
2020-04-13,08:46:24,thevikaskhanna,Dear All.  It’s a tough day in NY. Lost 2 friends to #coronavirus last night. 1 dear dear person critical in hospital.  Its 💔 when you can’t visit them one last time. 😰 Please tweet me pics of Golden Temple with a prayer.,2349
